{"candidate":"margin-0.3.2-actionable-context-v15","contractMaximumCostUSD":1.460882,"costBoundBasis":{"billingOverheadUSDPerCall":0.0002,"inputTokenCeilingPerCall":1000000,"modelCallsPerAgentAtMost":8,"note":"The input ceiling is an externally verified provider/model contract. The attempt allowance covers SDK retries, and the overhead allowance covers rounding. Verifiers soft token limits are not provider billing maxima.","outputTokenCeilingPerCall":1808,"upstreamAttemptsPerTurnAtMost":3},"durationMs":28318,"episodeCount":1,"episodes":[{"agentProcessCount":2,"checks":{"all_expected_annotations":true,"all_or_none":true,"attribution":true,"committed_all":true,"duplicate_free":true,"minimum_annotations":true,"no_unexpected_annotations":true,"required_commands":true,"required_recovery_observed":true,"source_expected":true,"valid_command_use":false,"valid_documents":true,"workspace_policy":true},"commandCount":9,"controlProfile":"role-separated-margin-only-v1","dimensions":{"efficiency":70.0,"integrity":100.0,"outcome":100.0,"protocol":75.0,"recovery":100.0},"durationMs":25198.948,"episodeID":"parallel_shards:0:1fe63b51c305","fingerprint":"1fe63b51c305211c00fbb9e4ab1bc1bde29f8d998ffdf1c4a2ddd1cb26e33297","invalidCommandCount":1,"logicalActors":[{"id":"urn:marginbench:author:73d5701e","name":"Author 73d5","phase":0,"seat":"author","type":"software"},{"id":"urn:marginbench:reviewer:d40fdcac","name":"Reviewer d40f","phase":0,"seat":"reviewer","type":"software"}],"marginSha256":"84c1161831f77b6bd31e93930676693aa95ff8a8d065770aa0b0d97aa66dc912","phasePolicy":"scenario-defined","repetition":0,"roleRuns":[{"seat":"author","stopCondition":"agent_completed","usage":{"cachedInputTokens":7680,"completionTokens":1447,"modelCalls":5,"promptTokens":14089,"reasoningTokens":1004,"reportedCostUSD":0.0007}},{"seat":"reviewer","stopCondition":"agent_completed","usage":{"cachedInputTokens":12032,"completionTokens":2505,"modelCalls":6,"promptTokens":17404,"reasoningTokens":1697,"reportedCostUSD":0.0009}}],"safetyPassed":true,"scenario":"parallel_shards","score":93.25,"sourcePreserved":true,"traceSeats":["author","reviewer"],"usage":{"cachedInputTokens":19712,"completionTokens":3952,"modelCalls":11,"promptTokens":31493,"reasoningTokens":2701,"reportedCostUSD":0.0016}}],"estimatedMaximumCostUSD":0.03,"exitCode":0,"infrastructureCodes":[],"liveBudget":{"enabled":true,"forwardedRequestCount":11,"grossReservedCostUpperBoundUSD":0.019266,"latchedClosed":false,"outstandingReservationCount":0,"policy":{"allowedModel":"qwen/qwen3.7-flash","billingOverheadUSDPerCall":0.0002,"inputPricePerMillion":0.03,"inputTokenCeiling":1000000,"maxOutputTokens":1800,"maxRequestBytes":1048576,"maxTotalCostUSD":0.03,"outputPricePerMillion":0.13,"responseTokenAllowance":8,"templateTokenAllowance":8192},"providerBoundViolationCount":0,"rejectedRequestCount":0,"reportedCompletionTokens":3952,"reportedPromptTokens":51205,"reportedTokenCostUSD":0.00205,"reservedCostUpperBoundUSD":0.00425,"settledRequestCount":11},"liveBudgetCapUSD":0.03,"marginSha256":"84c1161831f77b6bd31e93930676693aa95ff8a8d065770aa0b0d97aa66dc912","model":"qwen/qwen3.7-flash","paidModelsInvoked":true,"rawTracesCommitted":false,"repetitions":1,"scenarios":["parallel_shards"],"schema":"urn:marginbench:prime-run-summary:v1","status":"completed","traceConsistencyPassed":true,"traceCount":2,"wallet":{"after":{"balanceUSD":199.4229,"totalBillings":7},"before":{"balanceUSD":199.4245,"totalBillings":7},"observedDebitUSD":0.0016}}
