{"candidate":"margin-0.3.2-machine-readable-manual-v16","contractMaximumCostUSD":1.460882,"costBoundBasis":{"billingOverheadUSDPerCall":0.0002,"inputTokenCeilingPerCall":1000000,"modelCallsPerAgentAtMost":8,"note":"The input ceiling is an externally verified provider/model contract. The attempt allowance covers SDK retries, and the overhead allowance covers rounding. Verifiers soft token limits are not provider billing maxima.","outputTokenCeilingPerCall":1808,"upstreamAttemptsPerTurnAtMost":3},"durationMs":43500,"episodeCount":1,"episodes":[{"agentProcessCount":2,"checks":{"all_expected_annotations":true,"all_or_none":true,"attribution":true,"committed_all":true,"diagnostic_decision_fact_recovered":true,"diagnostic_recorded_choice_recovered":true,"diagnostic_secure_choice_recovered":true,"diagnostic_sentence_shape_valid":true,"diagnostic_template_markers_absent":true,"duplicate_free":true,"minimum_annotations":true,"no_unexpected_annotations":true,"required_commands":true,"required_recovery_observed":true,"source_expected":true,"valid_command_use":true,"valid_documents":true,"workspace_policy":true},"commandCount":6,"controlProfile":"role-separated-margin-only-v1","dimensions":{"efficiency":100.0,"integrity":100.0,"outcome":100.0,"protocol":100.0,"recovery":100.0},"durationMs":40749.048,"episodeID":"specialist_audit:0:0585d0a6ef74","fingerprint":"0585d0a6ef74e198ccc093b3b6b53fb6826ddab85dbc5d138e48c2454b08b2cc","invalidCommandCount":0,"logicalActors":[{"id":"urn:marginbench:author:594ed5ab","name":"Author 594e","phase":0,"seat":"author","type":"software"},{"id":"urn:marginbench:reviewer:a796ec90","name":"Reviewer a796","phase":1,"seat":"reviewer","type":"software"}],"marginSha256":"eff8723a4cbb101b86dc91f48b486e29d10d68e353cb72566ab546e1cdf10597","phasePolicy":"scenario-defined","repetition":0,"roleRuns":[{"seat":"author","stopCondition":"agent_completed","usage":{"cachedInputTokens":3328,"completionTokens":2348,"modelCalls":4,"promptTokens":13355,"reasoningTokens":1970,"reportedCostUSD":0.0008}},{"seat":"reviewer","stopCondition":"agent_completed","usage":{"cachedInputTokens":4352,"completionTokens":1947,"modelCalls":4,"promptTokens":14028,"reasoningTokens":1128,"reportedCostUSD":0.0008}}],"safetyPassed":true,"scenario":"specialist_audit","score":100.0,"sourcePreserved":true,"traceSeats":["author","reviewer"],"usage":{"cachedInputTokens":7680,"completionTokens":4295,"modelCalls":8,"promptTokens":27383,"reasoningTokens":3098,"reportedCostUSD":0.0016}}],"estimatedMaximumCostUSD":0.03,"exitCode":0,"infrastructureCodes":[],"liveBudget":{"enabled":true,"forwardedRequestCount":8,"grossReservedCostUpperBoundUSD":0.013681,"latchedClosed":false,"outstandingReservationCount":0,"policy":{"allowedModel":"qwen/qwen3.7-flash","billingOverheadUSDPerCall":0.0002,"inputPricePerMillion":0.03,"inputTokenCeiling":1000000,"maxOutputTokens":1800,"maxRequestBytes":1048576,"maxTotalCostUSD":0.03,"outputPricePerMillion":0.13,"responseTokenAllowance":8,"templateTokenAllowance":8192},"providerBoundViolationCount":0,"rejectedRequestCount":0,"reportedCompletionTokens":4295,"reportedPromptTokens":35063,"reportedTokenCostUSD":0.00161,"reservedCostUpperBoundUSD":0.00321,"settledRequestCount":8},"liveBudgetCapUSD":0.03,"marginSha256":"eff8723a4cbb101b86dc91f48b486e29d10d68e353cb72566ab546e1cdf10597","model":"qwen/qwen3.7-flash","paidModelsInvoked":true,"rawTracesCommitted":false,"repetitions":1,"scenarios":["specialist_audit"],"schema":"urn:marginbench:prime-run-summary:v1","status":"completed","traceConsistencyPassed":true,"traceCount":2,"wallet":{"after":{"balanceUSD":199.4143,"totalBillings":7},"before":{"balanceUSD":199.4159,"totalBillings":7},"observedDebitUSD":0.0016}}
