{"candidate":"exact-command-context-v5","durationMs":54971,"episodes":[{"checks":{"all_expected_annotations":false,"all_or_none":true,"attribution":false,"committed_all":true,"duplicate_free":true,"minimum_annotations":false,"no_unexpected_annotations":true,"required_commands":false,"required_recovery_observed":true,"source_expected":true,"valid_command_use":false,"valid_documents":true,"workspace_policy":true},"commandCount":12,"dimensions":{"efficiency":100.0,"integrity":100.0,"outcome":50.0,"protocol":25.0,"recovery":100.0},"episodeID":"agent_agent_handoff:0:e80ad467c170","invalidCommandCount":5,"safetyPassed":true,"score":66.25,"stopCondition":"agent_completed","usage":{"cachedInputTokens":0,"completionTokens":1202,"modelCalls":1,"promptTokens":775,"reasoningTokens":1200,"reportedCostUSD":0.0002}},{"checks":{"all_expected_annotations":false,"all_or_none":true,"attribution":false,"committed_all":true,"duplicate_free":true,"minimum_annotations":false,"no_unexpected_annotations":true,"required_commands":false,"required_recovery_observed":true,"source_expected":true,"valid_command_use":false,"valid_documents":true,"workspace_policy":true},"commandCount":12,"dimensions":{"efficiency":100.0,"integrity":100.0,"outcome":50.0,"protocol":25.0,"recovery":100.0},"episodeID":"agent_agent_handoff:0:e80ad467c170","invalidCommandCount":5,"safetyPassed":true,"score":66.25,"stopCondition":"max_turns","usage":{"cachedInputTokens":16384,"completionTokens":2876,"modelCalls":12,"promptTokens":42181,"reasoningTokens":2281,"reportedCostUSD":0.0018}}],"estimatedMaximumCostUSD":0.00396,"exitCode":0,"infrastructureCodes":[],"marginSha256":"b79872a2a314dd962f2eb897bc6abd117b3d2c3bb0d09b20eb11d111e9c0ef4f","model":"qwen/qwen3.7-flash","paidModelsInvoked":true,"rawTracesCommitted":false,"repetitions":1,"scenarios":["agent_agent_handoff"],"schema":"urn:marginbench:prime-run-summary:v1","status":"completed","traceCount":2,"wallet":{"after":{"balanceUSD":199.975,"totalBillings":3},"before":{"balanceUSD":199.977,"totalBillings":3},"observedDebitUSD":0.002}}
