{"candidate":"single-read-handoff-guidance-v3","costBoundBasis":{"billingOverheadUSDPerCall":0.0002,"inputTokenCeilingPerCall":1000000,"modelCallsPerAgentAtMost":10,"note":"The input ceiling is an externally verified provider/model contract. The attempt allowance covers SDK retries, and the overhead allowance covers rounding. Verifiers soft token limits are not provider billing maxima.","outputTokenCeilingPerCall":1200,"upstreamAttemptsPerTurnAtMost":3},"durationMs":71302,"episodeCount":1,"episodes":[{"checks":{"all_expected_annotations":true,"all_or_none":true,"attribution":true,"committed_all":true,"duplicate_free":true,"minimum_annotations":true,"no_unexpected_annotations":true,"required_commands":false,"required_recovery_observed":true,"source_expected":true,"valid_command_use":true,"valid_documents":true,"workspace_policy":true},"commandCount":14,"dimensions":{"efficiency":100.0,"integrity":100.0,"outcome":100.0,"protocol":75.0,"recovery":100.0},"durationMs":68540.87,"episodeID":"directory_handoff:0:3b9f1593fa6a","fingerprint":"3b9f1593fa6a6347148ebcf4fc20e4570519c18781722e6990e12fe2f7c22b5f","invalidCommandCount":0,"marginSha256":"c220c0d61de8d523a2d55e1226693acda7ee909e2d518cc25572737965d2c57e","repetition":0,"roleRuns":[{"seat":"author","stopCondition":"agent_completed","usage":{"cachedInputTokens":37760,"completionTokens":4224,"modelCalls":8,"promptTokens":46561,"reasoningTokens":3278,"reportedCostUSD":0.0023}},{"seat":"reviewer","stopCondition":"agent_completed","usage":{"cachedInputTokens":19968,"completionTokens":2141,"modelCalls":8,"promptTokens":35748,"reasoningTokens":1243,"reportedCostUSD":0.0016}}],"safetyPassed":true,"scenario":"directory_handoff","score":96.25,"sourcePreserved":true,"usage":{"cachedInputTokens":57728,"completionTokens":6365,"modelCalls":16,"promptTokens":82309,"reasoningTokens":4521,"reportedCostUSD":0.0039}}],"estimatedMaximumCostUSD":1.82136,"exitCode":0,"infrastructureCodes":[],"marginSha256":"c220c0d61de8d523a2d55e1226693acda7ee909e2d518cc25572737965d2c57e","model":"qwen/qwen3.7-flash","paidModelsInvoked":true,"rawTracesCommitted":false,"repetitions":1,"scenarios":["directory_handoff"],"schema":"urn:marginbench:prime-run-summary:v1","status":"completed","traceConsistencyPassed":true,"traceCount":2,"wallet":{"after":{"balanceUSD":199.9497,"totalBillings":4},"before":{"balanceUSD":199.9536,"totalBillings":4},"observedDebitUSD":0.0039}}
