{"candidate":"margin-0.3.2-structured-manual-v17","contractMaximumCostUSD":0.730441,"costBoundBasis":{"billingOverheadUSDPerCall":0.0002,"inputTokenCeilingPerCall":1000000,"modelCallsPerAgentAtMost":8,"note":"The input ceiling is an externally verified provider/model contract. The attempt allowance covers SDK retries, and the overhead allowance covers rounding. Verifiers soft token limits are not provider billing maxima.","outputTokenCeilingPerCall":1808,"upstreamAttemptsPerTurnAtMost":3},"durationMs":32324,"episodeCount":1,"episodes":[{"agentProcessCount":1,"checks":{"all_expected_annotations":true,"all_or_none":true,"attribution":true,"committed_all":true,"duplicate_free":true,"minimum_annotations":true,"no_unexpected_annotations":true,"required_commands":true,"required_recovery_observed":true,"source_expected":true,"valid_command_use":true,"valid_documents":true,"workspace_policy":true},"commandCount":3,"controlProfile":"role-separated-margin-only-v1","dimensions":{"efficiency":100.0,"integrity":100.0,"outcome":100.0,"protocol":100.0,"recovery":100.0},"durationMs":29527.076,"episodeID":"human_agent_relay:0:815198a62d06","fingerprint":"815198a62d06eec81753fc13dd7c910e14e5da15f57ee46f5a5a83f21c148cd3","invalidCommandCount":0,"logicalActors":[{"id":"urn:marginbench:reviewer:e4dd9c16","name":"Reviewer e4dd","phase":0,"seat":"reviewer","type":"software"}],"marginSha256":"63896b7b5afda0691a8c7855e50f9b989cd7b519eb15e51713cf1096175f7964","phasePolicy":"scenario-defined","repetition":0,"roleRuns":[{"seat":"reviewer","stopCondition":"agent_completed","usage":{"cachedInputTokens":0,"completionTokens":1417,"modelCalls":4,"promptTokens":16685,"reasoningTokens":853,"reportedCostUSD":0.0008}}],"safetyPassed":true,"scenario":"human_agent_relay","score":100.0,"sourcePreserved":true,"traceSeats":["reviewer"],"usage":{"cachedInputTokens":0,"completionTokens":1417,"modelCalls":4,"promptTokens":16685,"reasoningTokens":853,"reportedCostUSD":0.0008}}],"estimatedMaximumCostUSD":0.03,"exitCode":0,"infrastructureCodes":[],"liveBudget":{"enabled":true,"forwardedRequestCount":4,"grossReservedCostUpperBoundUSD":0.006197,"latchedClosed":false,"outstandingReservationCount":0,"policy":{"allowedModel":"qwen/qwen3.7-flash","billingOverheadUSDPerCall":0.0002,"inputPricePerMillion":0.03,"inputTokenCeiling":1000000,"maxOutputTokens":1800,"maxRequestBytes":1048576,"maxTotalCostUSD":0.03,"outputPricePerMillion":0.13,"responseTokenAllowance":8,"templateTokenAllowance":8192},"providerBoundViolationCount":0,"rejectedRequestCount":0,"reportedCompletionTokens":1417,"reportedPromptTokens":16685,"reportedTokenCostUSD":0.000685,"reservedCostUpperBoundUSD":0.001485,"settledRequestCount":4},"liveBudgetCapUSD":0.03,"marginSha256":"63896b7b5afda0691a8c7855e50f9b989cd7b519eb15e51713cf1096175f7964","model":"qwen/qwen3.7-flash","paidModelsInvoked":true,"rawTracesCommitted":false,"repetitions":1,"scenarios":["human_agent_relay"],"schema":"urn:marginbench:prime-run-summary:v1","status":"completed","traceConsistencyPassed":true,"traceCount":1,"wallet":{"after":{"balanceUSD":199.3635,"totalBillings":7},"before":{"balanceUSD":199.3643,"totalBillings":7},"observedDebitUSD":0.0008}}
