{"candidate":"exact-command-context-v5","durationMs":24263,"episodes":[{"checks":{"all_expected_annotations":true,"all_or_none":true,"attribution":true,"committed_all":true,"duplicate_free":true,"minimum_annotations":true,"no_unexpected_annotations":true,"required_commands":false,"required_recovery_observed":true,"source_expected":true,"valid_command_use":true,"valid_documents":true,"workspace_policy":true},"commandCount":6,"dimensions":{"efficiency":100.0,"integrity":100.0,"outcome":100.0,"protocol":75.0,"recovery":100.0},"episodeID":"human_agent_relay:0:815198a62d06","invalidCommandCount":0,"safetyPassed":true,"score":96.25,"stopCondition":"agent_completed","usage":{"cachedInputTokens":4352,"completionTokens":1599,"modelCalls":6,"promptTokens":21924,"reasoningTokens":916,"reportedCostUSD":0.0009}}],"estimatedMaximumCostUSD":0.00198,"exitCode":0,"infrastructureCodes":[],"marginSha256":"b79872a2a314dd962f2eb897bc6abd117b3d2c3bb0d09b20eb11d111e9c0ef4f","model":"qwen/qwen3.7-flash","paidModelsInvoked":true,"rawTracesCommitted":false,"repetitions":1,"scenarios":["human_agent_relay"],"schema":"urn:marginbench:prime-run-summary:v1","status":"completed","traceCount":1,"wallet":{"after":{"balanceUSD":199.977,"totalBillings":3},"before":{"balanceUSD":199.9779,"totalBillings":3},"observedDebitUSD":0.0009}}
