{"candidate":"typed-work-guidance-v7","durationMs":28675,"episodeCount":1,"episodes":[{"checks":{"all_expected_annotations":true,"all_or_none":true,"attribution":true,"committed_all":true,"duplicate_free":true,"minimum_annotations":true,"no_unexpected_annotations":true,"required_commands":true,"required_recovery_observed":true,"source_expected":true,"valid_command_use":false,"valid_documents":true,"workspace_policy":true},"commandCount":11,"dimensions":{"efficiency":58.333333,"integrity":100.0,"outcome":100.0,"protocol":75.0,"recovery":100.0},"episodeID":"concurrent_review:0:9117b49e318e","fingerprint":"9117b49e318eccfb03a225cd3c3e225fb4080418b78384e4301317fc03af0113","invalidCommandCount":1,"repetition":0,"roleRuns":[{"seat":"author","stopCondition":"agent_completed","usage":{"cachedInputTokens":5376,"completionTokens":2030,"modelCalls":6,"promptTokens":22766,"reasoningTokens":1604,"reportedCostUSD":0.001}},{"seat":"reviewer","stopCondition":"agent_completed","usage":{"cachedInputTokens":7552,"completionTokens":1471,"modelCalls":7,"promptTokens":17196,"reasoningTokens":1028,"reportedCostUSD":0.0009}}],"safetyPassed":true,"scenario":"concurrent_review","score":92.083333,"usage":{"cachedInputTokens":12928,"completionTokens":3501,"modelCalls":13,"promptTokens":39962,"reasoningTokens":2632,"reportedCostUSD":0.0019}}],"estimatedMaximumCostUSD":0.00396,"exitCode":0,"infrastructureCodes":[],"marginSha256":"03bbd82c11a2b332ce9feaec25254f1f6f9ac0bf1ba3402b1897c15853c26b5e","model":"qwen/qwen3.7-flash","paidModelsInvoked":true,"rawTracesCommitted":false,"repetitions":1,"scenarios":["concurrent_review"],"schema":"urn:marginbench:prime-run-summary:v1","status":"completed","traceConsistencyPassed":true,"traceCount":2,"wallet":{"after":{"balanceUSD":199.9675,"totalBillings":3},"before":{"balanceUSD":199.9694,"totalBillings":3},"observedDebitUSD":0.0019}}
