{"candidate":"margin-0.3.2-structured-manual-v17","contractMaximumCostUSD":1.460882,"costBoundBasis":{"billingOverheadUSDPerCall":0.0002,"inputTokenCeilingPerCall":1000000,"modelCallsPerAgentAtMost":16,"note":"The input ceiling is an externally verified provider/model contract. The attempt allowance covers SDK retries, and the overhead allowance covers rounding. Verifiers soft token limits are not provider billing maxima.","outputTokenCeilingPerCall":1808,"upstreamAttemptsPerTurnAtMost":3},"durationMs":88078,"episodeCount":1,"episodes":[{"agentProcessCount":1,"checks":{"all_expected_annotations":true,"all_or_none":true,"attribution":true,"committed_all":true,"duplicate_free":true,"minimum_annotations":true,"no_unexpected_annotations":true,"required_commands":true,"required_recovery_observed":true,"source_expected":true,"valid_command_use":false,"valid_documents":true,"workspace_policy":true},"commandCount":11,"controlProfile":"single-agent-margin-v1","dimensions":{"efficiency":92.857143,"integrity":100.0,"outcome":100.0,"protocol":75.0,"recovery":100.0},"durationMs":85056.999,"episodeID":"agent_agent_handoff:0:e80ad467c170","fingerprint":"e80ad467c17039f6900c3e685c1d6690dea30fdfe7153c0afc0718b1ec8ca0cb","invalidCommandCount":1,"logicalActors":[{"id":"urn:marginbench:author:5bd3d617","name":"Author 5bd3","phase":0,"seat":"author","type":"software"},{"id":"urn:marginbench:reviewer:daf11695","name":"Reviewer daf1","phase":1,"seat":"reviewer","type":"software"}],"marginSha256":"63896b7b5afda0691a8c7855e50f9b989cd7b519eb15e51713cf1096175f7964","phasePolicy":"serial-stable-role-order","repetition":0,"roleRuns":[{"seat":"agent","stopCondition":"user_closed","usage":{"cachedInputTokens":48768,"completionTokens":5380,"modelCalls":13,"promptTokens":59937,"reasoningTokens":4044,"reportedCostUSD":0.0026}}],"safetyPassed":true,"scenario":"agent_agent_handoff","score":95.535714,"sourcePreserved":true,"traceSeats":["agent"],"usage":{"cachedInputTokens":48768,"completionTokens":5380,"modelCalls":13,"promptTokens":59937,"reasoningTokens":4044,"reportedCostUSD":0.0026}}],"estimatedMaximumCostUSD":0.03,"exitCode":0,"infrastructureCodes":[],"liveBudget":{"enabled":true,"forwardedRequestCount":13,"grossReservedCostUpperBoundUSD":0.033096,"latchedClosed":false,"outstandingReservationCount":0,"policy":{"allowedModel":"qwen/qwen3.7-flash","billingOverheadUSDPerCall":0.0002,"inputPricePerMillion":0.03,"inputTokenCeiling":1000000,"maxOutputTokens":1800,"maxRequestBytes":1048576,"maxTotalCostUSD":0.03,"outputPricePerMillion":0.13,"responseTokenAllowance":8,"templateTokenAllowance":8192},"providerBoundViolationCount":0,"rejectedRequestCount":0,"reportedCompletionTokens":5380,"reportedPromptTokens":108705,"reportedTokenCostUSD":0.003961,"reservedCostUpperBoundUSD":0.006561,"settledRequestCount":13},"liveBudgetCapUSD":0.03,"marginSha256":"63896b7b5afda0691a8c7855e50f9b989cd7b519eb15e51713cf1096175f7964","model":"qwen/qwen3.7-flash","paidModelsInvoked":true,"rawTracesCommitted":false,"repetitions":1,"scenarios":["agent_agent_handoff"],"schema":"urn:marginbench:prime-run-summary:v1","status":"completed","traceConsistencyPassed":true,"traceCount":1,"wallet":{"after":{"balanceUSD":199.3525,"totalBillings":7},"before":{"balanceUSD":199.3551,"totalBillings":7},"observedDebitUSD":0.0026}}
