{"candidate":"workflow-routed-tool-v10","durationMs":135059,"episodeCount":1,"episodes":[{"checks":{"all_expected_annotations":true,"all_or_none":true,"attribution":true,"committed_all":true,"duplicate_free":true,"minimum_annotations":true,"no_unexpected_annotations":true,"required_commands":true,"required_recovery_observed":true,"source_expected":true,"valid_command_use":false,"valid_documents":true,"workspace_policy":true},"commandCount":18,"dimensions":{"efficiency":62.5,"integrity":100.0,"outcome":100.0,"protocol":75.0,"recovery":100.0},"episodeID":"staged_multifile:0:00a47f179db6","fingerprint":"00a47f179db6cf46601030ae44d931c673d30d883dc9a2c42faf4fe944dcecab","invalidCommandCount":1,"repetition":0,"roleRuns":[{"seat":"author","stopCondition":"agent_completed","usage":{"cachedInputTokens":4352,"completionTokens":1497,"modelCalls":7,"promptTokens":28979,"reasoningTokens":623,"reportedCostUSD":0.0013}},{"seat":"reviewer","stopCondition":"max_turns","usage":{"cachedInputTokens":38912,"completionTokens":2062,"modelCalls":12,"promptTokens":78478,"reasoningTokens":1259,"reportedCostUSD":0.0031}}],"safetyPassed":true,"scenario":"staged_multifile","score":92.5,"usage":{"cachedInputTokens":43264,"completionTokens":3559,"modelCalls":19,"promptTokens":107457,"reasoningTokens":1882,"reportedCostUSD":0.0044}}],"estimatedMaximumCostUSD":0.00396,"exitCode":0,"infrastructureCodes":[],"marginSha256":"414d0e37b511b3bcd01586c58af9f9d2a892136b03fb9f00d2db70ace0db20a9","model":"qwen/qwen3.7-flash","paidModelsInvoked":true,"rawTracesCommitted":false,"repetitions":1,"scenarios":["staged_multifile"],"schema":"urn:marginbench:prime-run-summary:v1","status":"completed","traceConsistencyPassed":true,"traceCount":2,"wallet":{"after":{"balanceUSD":199.9594,"totalBillings":3},"before":{"balanceUSD":199.9638,"totalBillings":3},"observedDebitUSD":0.0044}}
