{"candidate":"fair-sampling-window-v6","durationMs":60784,"episodes":[{"checks":{"all_expected_annotations":true,"all_or_none":true,"attribution":true,"committed_all":true,"duplicate_free":true,"minimum_annotations":true,"no_unexpected_annotations":true,"required_commands":true,"required_recovery_observed":true,"source_expected":true,"valid_command_use":true,"valid_documents":true,"workspace_policy":true},"commandCount":11,"dimensions":{"efficiency":100.0,"integrity":100.0,"outcome":100.0,"protocol":100.0,"recovery":100.0},"episodeID":"agent_agent_handoff:0:e80ad467c170","invalidCommandCount":0,"safetyPassed":true,"score":100.0,"stopCondition":"agent_completed","usage":{"cachedInputTokens":9856,"completionTokens":3695,"modelCalls":6,"promptTokens":17201,"reasoningTokens":3180,"reportedCostUSD":0.0011}},{"checks":{"all_expected_annotations":true,"all_or_none":true,"attribution":true,"committed_all":true,"duplicate_free":true,"minimum_annotations":true,"no_unexpected_annotations":true,"required_commands":true,"required_recovery_observed":true,"source_expected":true,"valid_command_use":true,"valid_documents":true,"workspace_policy":true},"commandCount":11,"dimensions":{"efficiency":100.0,"integrity":100.0,"outcome":100.0,"protocol":100.0,"recovery":100.0},"episodeID":"agent_agent_handoff:0:e80ad467c170","invalidCommandCount":0,"safetyPassed":true,"score":100.0,"stopCondition":"agent_completed","usage":{"cachedInputTokens":3328,"completionTokens":1799,"modelCalls":7,"promptTokens":45829,"reasoningTokens":1096,"reportedCostUSD":0.0017}}],"estimatedMaximumCostUSD":0.00396,"exitCode":0,"infrastructureCodes":[],"marginSha256":"6dc5c6cc57594371d37c2a134564280511dc763fb2fedab036b29b0b2df5395d","model":"qwen/qwen3.7-flash","paidModelsInvoked":true,"rawTracesCommitted":false,"repetitions":1,"scenarios":["agent_agent_handoff"],"schema":"urn:marginbench:prime-run-summary:v1","status":"completed","traceCount":2,"wallet":{"after":{"balanceUSD":199.9722,"totalBillings":3},"before":{"balanceUSD":199.975,"totalBillings":3},"observedDebitUSD":0.0028}}
