{"candidate":"topology-role-separated-v1","contractMaximumCostUSD":2.185632,"costBoundBasis":{"billingOverheadUSDPerCall":0.0002,"inputTokenCeilingPerCall":1000000,"modelCallsPerAgentAtMost":12,"note":"The input ceiling is an externally verified provider/model contract. The attempt allowance covers SDK retries, and the overhead allowance covers rounding. Verifiers soft token limits are not provider billing maxima.","outputTokenCeilingPerCall":1200,"upstreamAttemptsPerTurnAtMost":3},"durationMs":39840,"episodeCount":1,"episodes":[{"agentProcessCount":2,"checks":{"all_expected_annotations":true,"all_or_none":true,"attribution":true,"committed_all":true,"duplicate_free":true,"minimum_annotations":true,"no_unexpected_annotations":true,"required_commands":true,"required_recovery_observed":true,"source_expected":true,"valid_command_use":false,"valid_documents":true,"workspace_policy":true},"commandCount":8,"controlProfile":"role-separated-margin-only-v1","dimensions":{"efficiency":100.0,"integrity":100.0,"outcome":100.0,"protocol":75.0,"recovery":100.0},"durationMs":36932.001,"episodeID":"agent_agent_handoff:0:e80ad467c170","fingerprint":"e80ad467c17039f6900c3e685c1d6690dea30fdfe7153c0afc0718b1ec8ca0cb","invalidCommandCount":1,"logicalActors":[{"id":"urn:marginbench:author:5bd3d617","name":"Author 5bd3","phase":0,"seat":"author","type":"software"},{"id":"urn:marginbench:reviewer:daf11695","name":"Reviewer daf1","phase":1,"seat":"reviewer","type":"software"}],"marginSha256":"c220c0d61de8d523a2d55e1226693acda7ee909e2d518cc25572737965d2c57e","phasePolicy":"scenario-defined","repetition":0,"roleRuns":[{"seat":"author","stopCondition":"agent_completed","usage":{"cachedInputTokens":3200,"completionTokens":1663,"modelCalls":5,"promptTokens":12092,"reasoningTokens":1070,"reportedCostUSD":0.0006}},{"seat":"reviewer","stopCondition":"agent_completed","usage":{"cachedInputTokens":3328,"completionTokens":1475,"modelCalls":5,"promptTokens":22023,"reasoningTokens":811,"reportedCostUSD":0.0011}}],"safetyPassed":true,"scenario":"agent_agent_handoff","score":96.25,"sourcePreserved":true,"traceSeats":["author","reviewer"],"usage":{"cachedInputTokens":6528,"completionTokens":3138,"modelCalls":10,"promptTokens":34115,"reasoningTokens":1881,"reportedCostUSD":0.0017}}],"estimatedMaximumCostUSD":0.0495,"exitCode":0,"infrastructureCodes":[],"liveBudget":{"enabled":true,"forwardedRequestCount":10,"latchedClosed":false,"policy":{"allowedModel":"qwen/qwen3.7-flash","billingOverheadUSDPerCall":0.0002,"inputPricePerMillion":0.03,"inputTokenCeiling":1000000,"maxOutputTokens":1200,"maxRequestBytes":1048576,"maxTotalCostUSD":0.0495,"outputPricePerMillion":0.13,"templateTokenAllowance":8192},"providerBoundViolationCount":0,"rejectedRequestCount":0,"reportedCompletionTokens":3138,"reportedPromptTokens":40643,"reportedTokenCostUSD":0.001627,"reservedCostUpperBoundUSD":0.013615},"liveBudgetCapUSD":0.0495,"marginSha256":"c220c0d61de8d523a2d55e1226693acda7ee909e2d518cc25572737965d2c57e","model":"qwen/qwen3.7-flash","paidModelsInvoked":true,"rawTracesCommitted":false,"repetitions":1,"scenarios":["agent_agent_handoff"],"schema":"urn:marginbench:prime-run-summary:v1","status":"completed","traceConsistencyPassed":true,"traceCount":2,"wallet":{"after":{"balanceUSD":199.9469,"totalBillings":5},"before":{"balanceUSD":199.9486,"totalBillings":5},"observedDebitUSD":0.0017}}
