{"candidate":"margin-0.3.2-actionable-context-v15","contractMaximumCostUSD":1.460882,"costBoundBasis":{"billingOverheadUSDPerCall":0.0002,"inputTokenCeilingPerCall":1000000,"modelCallsPerAgentAtMost":16,"note":"The input ceiling is an externally verified provider/model contract. The attempt allowance covers SDK retries, and the overhead allowance covers rounding. Verifiers soft token limits are not provider billing maxima.","outputTokenCeilingPerCall":1808,"upstreamAttemptsPerTurnAtMost":3},"durationMs":54143,"episodeCount":1,"episodes":[{"agentProcessCount":1,"checks":{"all_expected_annotations":false,"all_or_none":true,"attribution":false,"committed_all":true,"diagnostic_decision_fact_recovered":false,"diagnostic_recorded_choice_recovered":true,"diagnostic_secure_choice_recovered":true,"diagnostic_sentence_shape_valid":true,"diagnostic_template_markers_absent":true,"duplicate_free":true,"minimum_annotations":false,"no_unexpected_annotations":true,"required_commands":true,"required_recovery_observed":true,"source_expected":true,"valid_command_use":false,"valid_documents":true,"workspace_policy":true},"commandCount":8,"controlProfile":"single-agent-margin-v1","dimensions":{"efficiency":100.0,"integrity":100.0,"outcome":50.0,"protocol":50.0,"recovery":100.0},"durationMs":50938.634,"episodeID":"specialist_audit:0:0585d0a6ef74","fingerprint":"0585d0a6ef74e198ccc093b3b6b53fb6826ddab85dbc5d138e48c2454b08b2cc","invalidCommandCount":1,"logicalActors":[{"id":"urn:marginbench:author:594ed5ab","name":"Author 594e","phase":0,"seat":"author","type":"software"},{"id":"urn:marginbench:reviewer:a796ec90","name":"Reviewer a796","phase":1,"seat":"reviewer","type":"software"}],"marginSha256":"84c1161831f77b6bd31e93930676693aa95ff8a8d065770aa0b0d97aa66dc912","phasePolicy":"serial-stable-role-order","repetition":0,"roleRuns":[{"seat":"agent","stopCondition":"user_closed","usage":{"cachedInputTokens":24320,"completionTokens":5095,"modelCalls":10,"promptTokens":32844,"reasoningTokens":3819,"reportedCostUSD":0.0018}}],"safetyPassed":true,"scenario":"specialist_audit","score":70.0,"sourcePreserved":true,"traceSeats":["agent"],"usage":{"cachedInputTokens":24320,"completionTokens":5095,"modelCalls":10,"promptTokens":32844,"reasoningTokens":3819,"reportedCostUSD":0.0018}}],"estimatedMaximumCostUSD":0.03,"exitCode":0,"infrastructureCodes":[],"liveBudget":{"enabled":true,"forwardedRequestCount":10,"grossReservedCostUpperBoundUSD":0.025376,"latchedClosed":false,"outstandingReservationCount":0,"policy":{"allowedModel":"qwen/qwen3.7-flash","billingOverheadUSDPerCall":0.0002,"inputPricePerMillion":0.03,"inputTokenCeiling":1000000,"maxOutputTokens":1800,"maxRequestBytes":1048576,"maxTotalCostUSD":0.03,"outputPricePerMillion":0.13,"responseTokenAllowance":8,"templateTokenAllowance":8192},"providerBoundViolationCount":0,"rejectedRequestCount":0,"reportedCompletionTokens":5095,"reportedPromptTokens":57164,"reportedTokenCostUSD":0.002377,"reservedCostUpperBoundUSD":0.004377,"settledRequestCount":10},"liveBudgetCapUSD":0.03,"marginSha256":"84c1161831f77b6bd31e93930676693aa95ff8a8d065770aa0b0d97aa66dc912","model":"qwen/qwen3.7-flash","paidModelsInvoked":true,"rawTracesCommitted":false,"repetitions":1,"scenarios":["specialist_audit"],"schema":"urn:marginbench:prime-run-summary:v1","status":"completed","traceConsistencyPassed":true,"traceCount":1,"wallet":{"after":{"balanceUSD":199.4199,"totalBillings":7},"before":{"balanceUSD":199.4217,"totalBillings":7},"observedDebitUSD":0.0018}}
