{"candidate":"margin-0.3.2-structured-manual-v17","contractMaximumCostUSD":1.460882,"costBoundBasis":{"billingOverheadUSDPerCall":0.0002,"inputTokenCeilingPerCall":1000000,"modelCallsPerAgentAtMost":8,"note":"The input ceiling is an externally verified provider/model contract. The attempt allowance covers SDK retries, and the overhead allowance covers rounding. Verifiers soft token limits are not provider billing maxima.","outputTokenCeilingPerCall":1808,"upstreamAttemptsPerTurnAtMost":3},"durationMs":102675,"episodeCount":1,"episodes":[{"agentProcessCount":2,"checks":{"all_expected_annotations":false,"all_or_none":true,"attribution":false,"committed_all":false,"duplicate_free":true,"minimum_annotations":false,"no_unexpected_annotations":true,"required_commands":true,"required_recovery_observed":true,"source_expected":true,"valid_command_use":false,"valid_documents":true,"workspace_policy":true},"commandCount":14,"controlProfile":"role-separated-margin-only-v1","dimensions":{"efficiency":87.5,"integrity":100.0,"outcome":25.0,"protocol":50.0,"recovery":100.0},"durationMs":99522.688,"episodeID":"staged_multifile:0:00a47f179db6","fingerprint":"00a47f179db6cf46601030ae44d931c673d30d883dc9a2c42faf4fe944dcecab","invalidCommandCount":3,"logicalActors":[{"id":"urn:marginbench:author:9eb173cf","name":"Author 9eb1","phase":0,"seat":"author","type":"software"},{"id":"urn:marginbench:reviewer:17a7aea6","name":"Reviewer 17a7","phase":1,"seat":"reviewer","type":"software"}],"marginSha256":"63896b7b5afda0691a8c7855e50f9b989cd7b519eb15e51713cf1096175f7964","phasePolicy":"scenario-defined","repetition":0,"roleRuns":[{"seat":"author","stopCondition":"agent_completed","usage":{"cachedInputTokens":3328,"completionTokens":2451,"modelCalls":7,"promptTokens":35468,"reasoningTokens":1519,"reportedCostUSD":0.0014}},{"seat":"reviewer","stopCondition":"max_turns","usage":{"cachedInputTokens":3328,"completionTokens":2935,"modelCalls":8,"promptTokens":44140,"reasoningTokens":2335,"reportedCostUSD":0.0018}}],"safetyPassed":true,"scenario":"staged_multifile","score":57.5,"sourcePreserved":true,"traceSeats":["author","reviewer"],"usage":{"cachedInputTokens":6656,"completionTokens":5386,"modelCalls":15,"promptTokens":79608,"reasoningTokens":3854,"reportedCostUSD":0.0032}}],"estimatedMaximumCostUSD":0.03,"exitCode":0,"infrastructureCodes":[],"liveBudget":{"enabled":true,"forwardedRequestCount":15,"grossReservedCostUpperBoundUSD":0.030938,"latchedClosed":false,"outstandingReservationCount":0,"policy":{"allowedModel":"qwen/qwen3.7-flash","billingOverheadUSDPerCall":0.0002,"inputPricePerMillion":0.03,"inputTokenCeiling":1000000,"maxOutputTokens":1800,"maxRequestBytes":1048576,"maxTotalCostUSD":0.03,"outputPricePerMillion":0.13,"responseTokenAllowance":8,"templateTokenAllowance":8192},"providerBoundViolationCount":0,"rejectedRequestCount":0,"reportedCompletionTokens":5386,"reportedPromptTokens":86264,"reportedTokenCostUSD":0.003288,"reservedCostUpperBoundUSD":0.006288,"settledRequestCount":15},"liveBudgetCapUSD":0.03,"marginSha256":"63896b7b5afda0691a8c7855e50f9b989cd7b519eb15e51713cf1096175f7964","model":"qwen/qwen3.7-flash","paidModelsInvoked":true,"rawTracesCommitted":false,"repetitions":1,"scenarios":["staged_multifile"],"schema":"urn:marginbench:prime-run-summary:v1","status":"completed","traceConsistencyPassed":true,"traceCount":2,"wallet":{"after":{"balanceUSD":199.3429,"totalBillings":7},"before":{"balanceUSD":199.3461,"totalBillings":7},"observedDebitUSD":0.0032}}
