{"candidate":"mutation-next-actions-v8","durationMs":86372,"episodeCount":1,"episodes":[{"checks":{"all_expected_annotations":true,"all_or_none":true,"attribution":true,"committed_all":true,"duplicate_free":true,"minimum_annotations":true,"no_unexpected_annotations":true,"required_commands":true,"required_recovery_observed":true,"source_expected":true,"valid_command_use":false,"valid_documents":true,"workspace_policy":true},"commandCount":19,"dimensions":{"efficiency":35.714286,"integrity":100.0,"outcome":100.0,"protocol":75.0,"recovery":100.0},"episodeID":"suggestion_decision:0:2accc247aebe","fingerprint":"2accc247aebecff868199d564896f7f574d967b0c5b30e49618019f8ce381dfc","invalidCommandCount":3,"repetition":0,"roleRuns":[{"seat":"author","stopCondition":"agent_completed","usage":{"cachedInputTokens":13184,"completionTokens":5321,"modelCalls":8,"promptTokens":27742,"reasoningTokens":4504,"reportedCostUSD":0.0016}},{"seat":"reviewer","stopCondition":"agent_completed","usage":{"cachedInputTokens":54272,"completionTokens":3347,"modelCalls":10,"promptTokens":36460,"reasoningTokens":2185,"reportedCostUSD":0.0021}}],"safetyPassed":true,"scenario":"suggestion_decision","score":89.821429,"usage":{"cachedInputTokens":67456,"completionTokens":8668,"modelCalls":18,"promptTokens":64202,"reasoningTokens":6689,"reportedCostUSD":0.0037}}],"estimatedMaximumCostUSD":0.00396,"exitCode":0,"infrastructureCodes":[],"marginSha256":"797392fe8d9ede201a20c74f50b796a0a2911ecad96a4be9cf658f6401a7652c","model":"qwen/qwen3.7-flash","paidModelsInvoked":true,"rawTracesCommitted":false,"repetitions":1,"scenarios":["suggestion_decision"],"schema":"urn:marginbench:prime-run-summary:v1","status":"completed","traceConsistencyPassed":true,"traceCount":2,"wallet":{"after":{"balanceUSD":199.9638,"totalBillings":3},"before":{"balanceUSD":199.9675,"totalBillings":3},"observedDebitUSD":0.0037}}
