{"candidate":"explicit-open-thread-completion-v3","durationMs":23401,"episodes":[{"checks":{"all_expected_annotations":false,"all_or_none":true,"attribution":false,"committed_all":true,"duplicate_free":true,"minimum_annotations":false,"required_commands":false,"required_recovery_observed":true,"source_expected":true,"valid_documents":true,"workspace_policy":true},"commandCount":3,"dimensions":{"efficiency":100.0,"integrity":100.0,"outcome":33.333333,"protocol":33.333333,"recovery":100.0},"episodeID":"human_agent_relay:0:815198a62d06","invalidCommandCount":0,"safetyPassed":true,"score":60.0,"stopCondition":"agent_completed","usage":{"cachedInputTokens":0,"completionTokens":1498,"modelCalls":3,"promptTokens":5963,"reasoningTokens":1424,"reportedCostUSD":0.0004}}],"estimatedMaximumCostUSD":0.00198,"exitCode":0,"infrastructureCodes":[],"marginSha256":"4e1875b24ac5477bd7b7ca09614d2666f4e4b2da967e26ad40ffdb4c6f6ab1c9","model":"qwen/qwen3.7-flash","paidModelsInvoked":true,"rawTracesCommitted":false,"repetitions":1,"scenarios":["human_agent_relay"],"schema":"urn:marginbench:prime-run-summary:v1","status":"completed","traceCount":1,"wallet":{"after":{"balanceUSD":199.9795,"totalBillings":3},"before":{"balanceUSD":199.9799,"totalBillings":3},"observedDebitUSD":0.0004}}
