{"candidate":"live-budget-proxy-smoke-v1","contractMaximumCostUSD":0.181824,"costBoundBasis":{"billingOverheadUSDPerCall":0.0002,"inputTokenCeilingPerCall":1000000,"modelCallsPerAgentAtMost":6,"note":"The input ceiling is an externally verified provider/model contract. The attempt allowance covers SDK retries, and the overhead allowance covers rounding. Verifiers soft token limits are not provider billing maxima.","outputTokenCeilingPerCall":800,"upstreamAttemptsPerTurnAtMost":1},"durationMs":28312,"episodeCount":1,"episodes":[{"checks":{"all_expected_annotations":true,"all_or_none":true,"attribution":true,"committed_all":true,"duplicate_free":true,"minimum_annotations":true,"no_unexpected_annotations":true,"required_commands":true,"required_recovery_observed":true,"source_expected":true,"valid_command_use":false,"valid_documents":true,"workspace_policy":true},"commandCount":5,"dimensions":{"efficiency":100.0,"integrity":100.0,"outcome":100.0,"protocol":75.0,"recovery":100.0},"durationMs":25300.117,"episodeID":"human_agent_relay:0:815198a62d06","fingerprint":"815198a62d06eec81753fc13dd7c910e14e5da15f57ee46f5a5a83f21c148cd3","invalidCommandCount":1,"marginSha256":"c220c0d61de8d523a2d55e1226693acda7ee909e2d518cc25572737965d2c57e","repetition":0,"roleRuns":[{"seat":"reviewer","stopCondition":"agent_completed","usage":{"cachedInputTokens":4352,"completionTokens":2168,"modelCalls":6,"promptTokens":21718,"reasoningTokens":1219,"reportedCostUSD":0.001}}],"safetyPassed":true,"scenario":"human_agent_relay","score":96.25,"sourcePreserved":true,"usage":{"cachedInputTokens":4352,"completionTokens":2168,"modelCalls":6,"promptTokens":21718,"reasoningTokens":1219,"reportedCostUSD":0.001}}],"estimatedMaximumCostUSD":0.02,"exitCode":0,"infrastructureCodes":[],"liveBudget":{"enabled":true,"forwardedRequestCount":6,"policy":{"allowedModel":"qwen/qwen3.7-flash","billingOverheadUSDPerCall":0.0002,"inputPricePerMillion":0.03,"inputTokenCeiling":1000000,"maxOutputTokens":800,"maxRequestBytes":1048576,"maxTotalCostUSD":0.02,"outputPricePerMillion":0.13,"templateTokenAllowance":8192},"rejectedRequestCount":0,"reportedCompletionTokens":2168,"reportedPromptTokens":26070,"reportedTokenCostUSD":0.001064,"reservedCostUpperBoundUSD":0.008847},"liveBudgetCapUSD":0.02,"marginSha256":"c220c0d61de8d523a2d55e1226693acda7ee909e2d518cc25572737965d2c57e","model":"qwen/qwen3.7-flash","paidModelsInvoked":true,"rawTracesCommitted":false,"repetitions":1,"scenarios":["human_agent_relay"],"schema":"urn:marginbench:prime-run-summary:v1","status":"completed","traceConsistencyPassed":true,"traceCount":1,"wallet":{"after":{"balanceUSD":199.9487,"totalBillings":4},"before":{"balanceUSD":199.9497,"totalBillings":4},"observedDebitUSD":0.001}}
