{"candidate":"margin-0.3.2-structured-manual-v17","contractMaximumCostUSD":1.460882,"costBoundBasis":{"billingOverheadUSDPerCall":0.0002,"inputTokenCeilingPerCall":1000000,"modelCallsPerAgentAtMost":8,"note":"The input ceiling is an externally verified provider/model contract. The attempt allowance covers SDK retries, and the overhead allowance covers rounding. Verifiers soft token limits are not provider billing maxima.","outputTokenCeilingPerCall":1808,"upstreamAttemptsPerTurnAtMost":3},"durationMs":63790,"episodeCount":1,"episodes":[{"agentProcessCount":2,"checks":{"all_expected_annotations":true,"all_or_none":true,"attribution":true,"committed_all":true,"diagnostic_handoff_evidence_recovered":true,"diagnostic_reply_handoff_evidence_recovered":true,"diagnostic_reply_private_evidence_recovered":true,"diagnostic_sentence_shape_valid":true,"diagnostic_template_markers_absent":true,"duplicate_free":true,"minimum_annotations":true,"no_unexpected_annotations":true,"required_commands":true,"required_recovery_observed":true,"source_expected":true,"valid_command_use":true,"valid_documents":true,"workspace_policy":true},"commandCount":8,"controlProfile":"role-separated-margin-only-v1","dimensions":{"efficiency":100.0,"integrity":100.0,"outcome":100.0,"protocol":100.0,"recovery":100.0},"durationMs":60720.691,"episodeID":"distributed_synthesis:0:d880973394fa","fingerprint":"d880973394fa66a42751def489a44ae667ed1bf2df39f979b6ce1b193ca9a479","invalidCommandCount":0,"logicalActors":[{"id":"urn:marginbench:author:70200df8","name":"Author 7020","phase":0,"seat":"author","type":"software"},{"id":"urn:marginbench:reviewer:1e0d377a","name":"Reviewer 1e0d","phase":1,"seat":"reviewer","type":"software"}],"marginSha256":"63896b7b5afda0691a8c7855e50f9b989cd7b519eb15e51713cf1096175f7964","phasePolicy":"scenario-defined","repetition":0,"roleRuns":[{"seat":"author","stopCondition":"agent_completed","usage":{"cachedInputTokens":6528,"completionTokens":1704,"modelCalls":4,"promptTokens":11692,"reasoningTokens":1272,"reportedCostUSD":0.0007}},{"seat":"reviewer","stopCondition":"agent_completed","usage":{"cachedInputTokens":0,"completionTokens":1443,"modelCalls":5,"promptTokens":30691,"reasoningTokens":846,"reportedCostUSD":0.0013}}],"safetyPassed":true,"scenario":"distributed_synthesis","score":100.0,"sourcePreserved":true,"traceSeats":["author","reviewer"],"usage":{"cachedInputTokens":6528,"completionTokens":3147,"modelCalls":9,"promptTokens":42383,"reasoningTokens":2118,"reportedCostUSD":0.002}}],"estimatedMaximumCostUSD":0.03,"exitCode":0,"infrastructureCodes":[],"liveBudget":{"enabled":true,"forwardedRequestCount":9,"grossReservedCostUpperBoundUSD":0.015213,"latchedClosed":false,"outstandingReservationCount":0,"policy":{"allowedModel":"qwen/qwen3.7-flash","billingOverheadUSDPerCall":0.0002,"inputPricePerMillion":0.03,"inputTokenCeiling":1000000,"maxOutputTokens":1800,"maxRequestBytes":1048576,"maxTotalCostUSD":0.03,"outputPricePerMillion":0.13,"responseTokenAllowance":8,"templateTokenAllowance":8192},"providerBoundViolationCount":0,"rejectedRequestCount":0,"reportedCompletionTokens":3147,"reportedPromptTokens":48911,"reportedTokenCostUSD":0.001876,"reservedCostUpperBoundUSD":0.003676,"settledRequestCount":9},"liveBudgetCapUSD":0.03,"marginSha256":"63896b7b5afda0691a8c7855e50f9b989cd7b519eb15e51713cf1096175f7964","model":"qwen/qwen3.7-flash","paidModelsInvoked":true,"rawTracesCommitted":false,"repetitions":1,"scenarios":["distributed_synthesis"],"schema":"urn:marginbench:prime-run-summary:v1","status":"completed","traceConsistencyPassed":true,"traceCount":2,"wallet":{"after":{"balanceUSD":199.3758,"totalBillings":7},"before":{"balanceUSD":199.3778,"totalBillings":7},"observedDebitUSD":0.002}}
